[
  {
    "id": "fisheries-data-sufficiency",
    "problem_id": "food-security/fisheries-overexploitation-west-africa",
    "claim": "Available public data sources are sufficient to establish that West African fisheries are overexploited at a regional scale (FAO SOFIA 2024, Palomares et al. 2020) and to map industrial fishing effort from satellite AIS data (Kroodsma et al. 2018, Global Fishing Watch), and to estimate the magnitude of unreported catches via reconstruction (Sea Around Us, Belhabib et al. 2015). However, no public dataset provides sub-national fisheries overexploitation risk maps that combine vessel activity, catch reconstruction, and coastal community dependence at district-level grain for West African countries. The available data can support country-level and EEZ-level analysis but cannot identify which specific coastal communities face the highest livelihood risk from stock depletion without supplementary sub-national livelihood and catch data that does not currently exist in a comparable cross-country form.",
    "domain": ["food-security", "biodiversity"],
    "status": "unverified",
    "evidence": [
      "fao-sofia-2024",
      "pauly-sea-around-us-west-africa-2022",
      "kroodsma-gfw-global-fishing-2018",
      "global-fishing-watch-data-portal",
      "belhabib-west-africa-iuu-catch-2015",
      "worldpop-coastal-population-data",
      "palomares-africa-fisheries-status-2020"
    ],
    "failure_modes": [
      "A reader treats Global Fishing Watch apparent fishing effort as direct catch volume, conflating vessel presence with catch biomass.",
      "A reader uses the 2.4x catch reconstruction multiplier as a current figure when it covers 1950-2010 and may not reflect post-2010 changes in fleet dynamics or policy.",
      "A reader uses WorldPop coastal population density as a direct proxy for fisheries dependence without acknowledging that proximity does not equal livelihood reliance.",
      "A decision-maker uses satellite vessel density to justify enforcement actions against artisanal fishers when the AIS data primarily captures industrial vessels.",
      "A reader treats CMSY++ stock assessments as equivalent to full formal stock assessments, overstating the precision of the 53 percent overfished figure.",
      "A reader generalizes the regional 40 percent IUU gap to individual countries without accounting for country-level variation in reconstruction uncertainty."
    ],
    "kill_condition": "A reviewer identifies a public dataset providing sub-national fisheries catch, vessel activity, and community livelihood data at district-level grain for at least five West African countries with consistent methodology and less than 3-year reporting lag, or finds that a West African fisheries management body has begun systematic sub-national overexploitation risk reporting covering coastal districts in at least five countries.",
    "review_required": ["domain-reviewer", "red-team-reviewer"],
    "safety_level": "medium",
    "submitter": "codex-agent",
    "created_date": "2026-06-30",
    "last_updated": "2026-06-30",
    "confidence": "medium",
    "limitations": [
      "The claim is about public data availability for sub-national fisheries overexploitation risk analysis, not about actual stock status or community livelihoods in specific locations.",
      "The assessment that no comparable cross-country sub-national dataset exists is an inference from reviewing available data portals and published literature, not a systematic survey of all national fisheries databases.",
      "Some West African countries may have national fisheries monitoring systems that are not publicly accessible or not in English; these were not reviewed.",
      "The FAO SOFIA 2024 report may contain more granular country-level data than the public summary; this claim is based on the publicly accessible version."
    ]
  }
]
